Tags,Meaning
julia-pkg,Package manager for the Julia language.
rakudo-star,"rakudo-star is a distribution of rakudo, and bundles the rakudo Perl 6 compiler, the Parrot virtual machine, many modules, and documentation, including the latest draft of a book on Perl 6.  "
corretto,"Amazon Corretto is a no-cost, multiplatform, production-ready distribution of the Open Java Development Kit (OpenJDK)"
geckoview,"Use for questions about using GeckoView, an open-source library that allows you to render web content on Android using the Gecko web engine. Created and maintained by Mozilla and the community open source community. More info https://geckoview.dev/"
spring-data-jpa,Spring Data - JPA is part of the Spring Data umbrella project which makes it easy to implement JPA based repositories
python-3.7,"Version of the Python programming language released in June 27, 2018. For issues that are specific to Python 3.7. Use the more generic [python] and [python-3.x] tags where possible."
npm-package,
r-recipes,recipes is an R package by Max Kuhn and Hadley Wickham for creating and preprocessing design matrices.
deno-lint,
jitsi,"Jitsi is a free and open source VoIP, videoconferencing and instant messaging application for Windows, Linux and Mac OS X."
tornado,Tornado is a scalable web server and web framework for Python specializing in handling thousands of simultaneous connections and real-time services.
watchkit,"WatchKit is an integral part of the Apple Watch experience for third-party applications. It contains the classes for creating Apple Watch applications and it ensures that an Apple Watch application can talk to its corresponding WatchKit extension.
"
mingw-w64,The MinGW-w64 (MinGW fork) project is a complete runtime environment for gcc to produce binaries native to Windows 64-bit and 32-bit operating systems.
annotate,"Use this tag for questions related to annotating plots, e.g. adding descriptive labels or annotations to data points."
rollupjs,Rollup.js is a next-generation JavaScript Transpiler and module bundler
mediadevices,
mapbox-ios,Use when developing iOS apps with a Mapbox SDK. Prefer to use a more specific SDK tag instead. 
python-packaging,Packages are namespaces which contain multiple packages and modules themselves.
ansible-2.x,"Ansible is a radically simple IT automation platform that makes your applications and systems easier to deploy. Avoid writing scripts or custom code to deploy and update your applications— automate in a language that approaches plain English, using SSH, with no agents to install on remote systems"
iso-prolog,ISO/IEC has standardized Prolog. The standard is maintained by ISO/IEC JTC1/SC22/WG17.
skview,SKView is the UIView subclass Sprite Kit uses to render the currently presented scene&#39;s nodes onto. All nodes displayed by Sprite Kit are children (so to speak) of a SKView.
packet-sniffers,A software or a piece of computer hardware that can intercept and log traffic passing over a digital network or part of a network
summernote,Super simple WYSIWYG Editor using Bootstrap.
language-comparisons,Questions comparing two or more programming or markup languages against each other.
delaunay,"A *Delaunay* triangulation is a triangulation such that no vertex of the triangulation is inside the interior of the circumcircle of any triangle of the triangulation.
"
agent,Questions about programming software agents or programming in an agent-oriented environment.
material-design-lite,"Material Design Lite (or MDL for short) is an implementation of Material Design for the web by Google. Take note that Material Design Lite is currently in **limited support**, which means that no further development is taking place. Consider using Material Design Components for the Web instead."
azerothcore,"For PROGRAMMING questions about AzerothCore, the open source MMORPG game-server framework. Non-programming questions are off-topic.

Use this tag for AzerothCore based programming questions such as database programming, c++ questions, script programming, programming custom modules, etc. General support/configuration questions are off-topic.

Stack Overflow should NOT be used to just report bugs, as bugs should be reported as GitHub issues."
opengl-es-2.0,Subset of the OpenGL 3D graphics API designed for embedded devices such as mobile phones. This version 2.0 eliminates most of the fixed-function rendering pipeline in favor of a programmable one.
sap-basis,"Software platform that forms the base of an SAP system and on which SAP applications and components are build. Use this tag for SAP system architecture, system administration, database abstraction, transactional processing, software distribution management, authorisations and security and similar topics.  Do not use this tag for application specific questions.  "
delta,A Delta is a file which represents the changes between two or more revisions of structured or semi-structured data
smallrye,
semantic-versioning,Semantic Versioning is a community-driven version-numbering standard.  Use this tag to indicate the software versioning concepts defined at http://semver.org.
acme.sh,Used for questions related to Neil  https://github.com/Neilpang/acme.sh  acme shell script. This script is used to get and renew SSL certificates in Apace and other web servers from Let&#39;s encrypt and other certificate providers.
row-level-security,Row-level security is database security term which relates to the ability to define and enforce access control logic on rows of data such that a user can only retrieve the rows of data he or she is allowed to view.
serial-number,A unique code assigned for identification of a single unit or device.
iostream,The C++ iostream library is an object-oriented library that provides input and output functionality using streams. The iostreams classes support type-safe I/O of built-in types and can be extended to support user-defined types by overloading the &gt;&gt; and &lt;&lt; operators. 
timespec,&#39;timespec&#39; is a structure allowing to store the time since Epoch (1. Jan 1970)  providing nano seconds along with seconds. It is a POSIX extension to the C Standard to be declared in &#39;&lt;time.h&gt;&#39;.
udpclient,UdpClient (System.Net.Sockets.UdpClient) is a .NET-Class allowing to send and receive UDP-Traffic.
sql-server-data-tools,"SQL Server Data Tools (SSDT) introduces an ubiquitous, declarative model that spans all the phases of database development and maintenance/update inside Visual Studio. The developer can use SSDT TSQL design capabilities to build, debug, maintain and refactor databases whether working with a database project, or directly with a connected database instance located on or off-premise."
android-styles,A style is a collection of properties that specify the look and format for a View or window
sparse-matrix,"A sparse matrix is a data structure in which not every entry is explicitly represented. Related are sparse matrix algorithms and data structures, along with questions about implementation and analyses."
roxygen2,"roxygen2 is a Doxygen-like in-source documentation system for Rd, collation, and NAMESPACE.  Its primary use is in documenting R functions in-line with the function definition."
numberformatexception,A NumberFormatException occurs in Java code when a programmer tries to convert a String into a number and the conversion fails.
python-multithreading,python-multithreading refers to how to divide work into multiple streams of execution in Python.
amazon-connect,Amazon Connect is a cloud-based contact center solution.
vuex4,Vuex 4 is the version compatible with Vue.js 3
matlab,"MATLAB is a high-level language and interactive programming environment for numerical computation and visualization developed by MathWorks. Don’t use both the [matlab] and [octave] tags, unless the question is explicitly about the similarities or differences between the two. When using this tag, please mention the MATLAB release you&#39;re working with (e.g. R2017a)."
risk-analysis,"The tag should be used whenever the probability and/or the severity of one or multiple events should be quantified. It may refer to certain finance topics, but is not limited to that."
interop,Interoperability is a requirement for one computer system or programming language to work with another.
mono,"Mono is an open source implementation of .NET that runs on many platforms, including Linux, Mac OS X, and Windows.  This allows running .NET applications on platforms other than Windows with little to no modification."
indices,Use this tag for questions about specifying or selecting the correct information from a structure using indices. 
salesforce,A Platform-as-a-Service development environment delivered on Salesforce.com - the platform is more correctly referred to as Force.com. A dedicated Salesforce Stack Exchange is available for all your Salesforce questions at https://salesforce.stackexchange.com/
promql,Use the promql tag when your question is related to how to formulate promql query strings related to data for which you are querying in Prometheus. Other relevant reasons might exist but this is the main purpose.
gnu-coreutils,"Use this tag for questions specific to the GNU Core Utilities. If possible, add more specific tags such as &quot;kill&quot;, &quot;chown&quot;, &quot;uniq&quot; et cetera."
kubelet,"kubernetes related, the kubelet is the primary “node agent” that runs on each node"
scrollbar,"A scrollbar is a graphical user interface element relating to a display which is only partially visible. The scroll bar provides visual feedback on which portion of the element is in view, and the ability to move the view of the main element."
primes,"Primes or prime numbers are integers greater than 1 which are divisible only by themselves and 1, i.e.: 2, 3, 5, 7, 11, ... . "
cursor-position,
google-cloud-dataproc,"Google Cloud Dataproc is a managed Hadoop MapReduce, Spark, Pig and Hive service on Google Cloud Platform. The service provides GUI, CLI and HTTP API access modes for deploying/managing clusters and submitting jobs onto clusters."
ecj,Eclipse has implemented its own compiler called as Eclipse Compiler for Java (ECJ). This tag is for questions relating to the behaviour of that compiler.
python-requests-html,"Requests-HTML is a Python HTTP library built around the requests API, adding support for parsing HTML (with optional headless-browser support to render JavaScript)."
react-native-sqlite-storage,
application-xml,
caption,"A title text that is optically separated from the main text of an article. Language-independent concept, occurs in languages as HTML, LaTeX and Markdown."
copy-constructor,"A copy constructor is a constructor that creates a new object that is a clone of an existing object. The term is mostly used in the C++ programming language, where copy constructors have a special status."
jmenu,
typo3-extensions,The Content Management System (CMS) TYPO3 can be easily extended by plugins which are called &quot;extension&quot; in the TYPO3 world.
blacklist,"A blacklist is a list of entities that are banned from some access or action (entities not in the blacklist are authorized, including unknown entities).
"
sidecar,
archive,"A location or file that stores other files or data, normally accompanied by compression, encryption, sorting or organizing."
ruby-on-rails-6,"Ruby on Rails 6 is the latest version of Ruby on Rails, &quot;an open-source web framework that&#39;s optimized for programmer happiness and sustainable productivity.&quot;"
objective-c,"This tag should be used only on questions that are about Objective-C features or depend on code in the language. The tags [cocoa] and [cocoa-touch] should be used to ask about Apple&#39;s frameworks or classes. Use the related tags [ios], [macos], [apple-watch] and [tvos] for issues specific to those platforms."
react-aria,
syntax-error,A syntax error occurs when a program does not follow the syntactical rules of the programming language.
profile,Profiles are part of .NET Framework. Profiles allows you simply manage your users.
sbt,"sbt is an open source build tool for Scala and Java projects, similar to Java&#39;s Maven or Ant."
cucumber-spring,
winforms,"WinForms is the informal name given to Windows Forms, a GUI class library in the Microsoft .NET Framework and Mono. Questions in this tag should also be tagged with the target framework ([.net] or [mono]) and should ordinarily be tagged with a programming language tag."
well-formed,"A well-formed expression is one that is consistent with a known set of rules for syntax, structure, or any of various constraints of a formal system. 

A common example is that of a well-formed XML document, where the syntax of the document is capable of being parsed and recognized as XML, even though the content of the document may not be meaningful or accurate. "
sql-server-agent,"SQL Server Agent is a Microsoft Windows service that executes scheduled administrative tasks, which are called jobs. SQL Server Agent uses SQL Server to store job information. Jobs contain one or more job steps. Each step contains its own task, for example, backing up a database. SQL Server Agent can run a job on a schedule, in response to a specific event, or on demand."
magento-2.3,
elixir,"Elixir is an open-source, dynamic, compiled, general purpose functional programming language. It was designed to be fully compatible with the Erlang platform and is well suited to writing fault-tolerant, distributed applications with soft real-time guarantees and the ability for hot-code-swapping."
addressbook,An address book or a name and address book (NAB) is a book or a database used for storing entries called contacts.
android-viewgroup,"A ViewGroup is a special view that can contain other views, called children. The view group is the base class for layouts and views containers"
locationmanager,"The LocationManager class in Android provides access to the system location services. These services allow applications to obtain periodic updates of the device&#39;s geographical location, or to fire an application-specified Intent when the device enters the proximity of a given geographical location."
accessibility,"Accessibility seeks to make an application or website usable by everyone, including people with disabilities such as visual, auditory, ambulatory, or cognitive impairment. "
rego,"Rego is a Query Language. To make a policy decision in Rego, you write logical tests on the data that comes in as input (such as the API or SSH data from the last section)"
google-api-nodejs-client,"google-api-nodejs-client is Google&#39;s officially supported node.js client library for accessing Google APIs, it also supports authorization and authentication with OAuth 2.0."
generic-constraints,A generic constraint will restrict the types that can be used for a specific generic. Use this tag for questions regarding generic constraints.
powershell-core,"Use this tag for questions about writing and executing scripts for PowerShell Core, the cross-platform command line and scripting utility from Microsoft. Questions about Windows PowerShell (the original, Windows-only edition) should be tagged [powershell]. Questions about system administration should be asked on SuperUser."
flip,"a UI effect. for other flip types, see [flipboard] [swap] [bit-twiddling]"
recursive-type,Use for questions about types whose definition references itself as a type of its constituents
aws-codeartifact,
bounded-types,"A bounded type is a data type that has, by construction, upper and/or lower bounds on the values that inhabit it."
git-cherry-pick,This command applies the changes introduced by some existing commits.
extbase,Extbase is a TYPO3 CMS extension development framework working closely with TYPO3 Fluid and TYPO3&#39;s Extension Builder.
data-vault,"Data Vault is a methodology and architecture created to address the business of designing, implementing, and managing a data warehouse."
overloading,"The terms overloading and overloaded may refer to:

  - Constructor and method overloading, a type of polymorphism where different functions with the same name are invoked based on the data types of the parameters passed
  - Operator overloading, a form of functional or method overloading where the action being overloaded is an operator, such as + or -"
line,"The shortest distance between two points. Or, a row of characters in text output."
mindstorms,This tag is used to ask questions about the programmable aspects of the LEGO Mindstorms product line.  More specific tags about the version of the programmable controls and software should also be used.  These tags would be RCX or NXT or EV3. 
bazel-rules-nodejs,
google-console-developer,"Google Cloud Platform / Google Developer console lets you build, deploy, and scale applications, websites, and services on the same infrastructure as Google.
"
bottom-sheet,Material design concept - bottom sheets slide up from the bottom of the screen to reveal more content.
u-boot,Das U-boot is a GPL&#39;d bootloader for embedded boards supporting multiple processor architectures.
exponential-backoff,
ev3,Use this tag if your question is concerned specifically with mindstorms ev3. Otherwise use `mindstorms`
refund,
language-history,
launch-screen,
ravendb4,RavenDB in version 4.0
forestadmin,Forest Admin provides an off-the-shelf admin panel based on a highly-extensible API hosted on your servers.
data.table,"The R data.table package is an extension of data.frame built for fast in-memory data analysis. Use the dt tag for the DataTables package with Shiny (DT).
"
materialize,"An open-sourced, modern, responsive front-end framework based on Material Design"
umd,"Universal Module Definition (UMD) is an API for JavaScript modules that are capable of working in browsers, on the server, or elsewhere."
dex,.dex files are compiled Android application code files.
ngrx-reducers,
orders,"USE ONLY for related questions to e-commerce.
DO NOT USE in all other cases."
ios-animations,Animations provide fluid visual transitions between different states of your user interface.
crashpad,
notificationcenter,Notification Center is an interface designed by Apple that allows users to easily view notifications from all applications in one view. Notification Center is available in iOS 5 and up.
payara,Payara is a drop-in replacement for the open source GlassFish Application Server
reql,ReQL is the RethinkDB query language. It offers a convenient way to manipulate JSON documents. 
operators,"Operators are symbols that occur in nearly all programming and coding languages, for performing calculations and comparisons on data."
tcpportsharing,
flutteramplify,
guard-clause,"In function definitions by clauses with pattern matching, guards are Boolean expressions which augment pattern matching with the possibility to skip a pattern even if an argument structure matches the pattern."
golang-migrate,golang-migrate is a database migration tool written in Go. Questions tagged golang-migrate should be directly related to database migrations in Go.
opengl-4,"OpenGL 4 is the current iteration of the OpenGL standard, designed to reflect newest capabilities of modern GPU in 3D rendering. OpenGL 4 requires DX11 level hardware."
dt,DT is an R package that provides an interface to the JavaScript library DataTables. Use the data.table tag for questions related to the data.frame extension package data.table.
google-nearby-connections,
tabulator,"Tabulator is a table generating JavaScript library. It is extremely flexible in manipulating tables and all the information within it. It also allows for external loading and saving. It can handle HTML, CSV, XML and JSON. See http://tabulator.info/"
timing,timing is a numerical measurement of the how long it takes to execute an instruction or series of instructions
spring-data-elasticsearch,"Spring Data makes it easier to build Spring-powered applications that use new data access technologies such as non-relational databases, map-reduce frameworks, and cloud based data services as well as provide improved support for relational database technologies."
romejs,For questions about the experimental JavaScript toolchain from Facebook
web-notifications,The Web Notifications API provides a way for a web application to show a platform-level notification to a users — outside of a browser’s viewport and regardless of whether the web application that generated the notification is in the currently-active tab/window.
angular2-moment,Angular2 moment provides pipes for using momentjs methods in the angular environment. Make sure to include momentjs and angular tags along with this tag. Use angular-moment tag for the angularjs version of the library.
babel-register,
apache-kafka-connect,Apache Kafka Connect is a tool for scalable and reliable streaming data between Apache Kafka and other data systems.
psycopg2,Psycopg is a PostgreSQL adapter for Python programming language. It implements PEP 249 with many extensions.
saga,"A pattern that enables a service bus to deal with long-running processes, fault tolerance and scalability. "
cowplot,"The cowplot package is a simple add-on to ggplot2. It is meant to provide a theme for ggplot2 that is especially useful for formatting plots for publication in academic journals, and it also provides tools to neatly arrange multiple plots of different types, while minimizing the amount of required fiddling with sizes of axis labels, plot backgrounds, etc."
soundwaves,
vstack,A Swift UI view that arranges its children in a vertical line.
channels,
drawtext,
reference-type,"In programming language theory, a reference type is a data type that refers to an object in memory."
timeoutexception,TimeoutException is thrown when the time allotted for a process or operation has expired.
android-database,General programmatic usage of databases on Android
arrow-kt,Λrrow is a library for Typed Functional Programming in Kotlin
bootstrap-datepicker,bootstrap-datepicker is a datepicker widget by uxsolutions (eternicode) that uses Twitter&#39;s bootstrap library. (Forked from eyecon) 
array-broadcasting,"Broadcasting (or singleton expansion) applies a function element-wise across one or more multidimensional arrays, matching shapes of the arguments by repeating missing or singleton dimensions. Be sure to also tag the programming language; many languages with strong array support have implicit or explicit broadcasting behaviors, sometimes with idiosyncratic rules."
trailing,"Trailing characters are characters at the end of a string that should be removed for reason (eg. trailing zeros in &quot;0.5000&quot;, trailing spaces in &quot;hello &quot;, trailing slash in a URL, trailing newline character, etc.)."
value-initialization,Preparing an object or variable for use and assigning starting data to it.
lldb,"LLDB is a debugger built as a set of reusable components which highly leverage existing libraries in the larger LLVM Project, such as the Clang expression parser and LLVM disassembler."
extrapolation,extrapolation is a method of constructing new data points outside the range of a discrete set of known data points
type-erasure,"In Java, type erasure is the process where the compiler removes all information related to type parameters and type arguments within a class or method when a generic type is instantiated.  

In C++ type erasure refers to a technique for hiding some or all of the type information regarding a class."
ocamlfind,"Findlib is a library manager for Objective Caml. It provides a convention how to store libraries, and a file format (&quot;META&quot;) to describe the properties of libraries. There is also a tool (ocamlfind) for interpreting the META files, so that it is very easy to use libraries in programs and scripts. "
brython,Brython is a browser-integrated Python engine.
jmeter,"Apache JMeter is an open source Java application, designed to load-test functional behavior and measure performance. Originally designed for testing Web Applications, it has since expanded to other test functions as well."
mutators,"Anything related to mutators (a.k.a. setters, or mutator methods) in object oriented programming, i.e. instance methods whose exclusive purpose is to change (part of) the internal state of an object to a specific value, without performing substantial additional processing.. This may also refer to mutator functions in non-OO languages when OOP techniques are used to emulate OOP-like encapsulation."
webpack-style-loader,
zappa,"Zappa is a Python tool to build and deploy server-less, event-driven Python applications (including, but not limited to, WSGI web apps) on AWS Lambda + API Gateway."
camera-calibration,"In Computer Vision, camera-calibration is the process of finding the true parameters of the camera that produced a given photograph or video. Usually, the camera parameters are represented in a 3 &#215; 4 matrix called the camera matrix."
external-tools,External tools are a mechanism within Intellij-IDEA to provide a shareable process.
tomcat,"Use this tag for questions about Apache Tomcat (or simply Tomcat, formerly also Jakarta Tomcat) which is an open source Servlet Container developed by the Apache Software Foundation (ASF).  Most questions should also include a tag specifying the operating system."
converters,"Converters can change data from one type to another, translate data based on cultural information, or modify other aspects of presentation. "
