Tags,Meaning
sycl,"SYCL (pronounced ‘sickle’) is a royalty-free, cross-platform abstraction layer that builds on the underlying concepts, portability and efficiency of OpenCL that enables code for heterogeneous processors to be written in a “single-source” style using completely standard C++."
libv8,A gem for distributing the v8 runtime libraries and headers in both source and binary form.
highdpi,
jspsych,A JavaScript library for creating and running behavioral experiments in a web browser.
clang-tidy,For questions about clang-tidy as a static analyzer and code modernization tool. For more generic questions such as compiler diagnostic messages use the clang tag.
wmi,Windows Management Instrumentation (WMI) is an API for managing the Windows operating system on local or remote computers.
c#-7.3,
pear,"PEAR is a repository of PHP software code, designed to offer some functionality not built into PHP core"
podfile-lock,
javascript-debugger,"JavaScript debugger are tools that let you debug your JavaScript code by pausing the execution at any time, step through the code and see what each variable available looks like at that moment."
rich-text-editor,"A rich-text editor allows to edit, enter and format content in a web browser with rich markup and styles close to its final appearance."
odp.net-managed,The Oracle Managed DataAccess Provider is the .Net Native version of ODP.Net. It doesn&#39;t need a prior Oracle Client installation or have any dependency on the OCI library.  Applications that reference it may therefore be built &#39;AnyCPU&#39;.
keycloak-gatekeeper,Keycloak is an Open Source Identity and Access Management solution for modern Applications and Services. Gatekeeper is an application for use with OpenID Connect (OIDC) that supports both access tokens in a browser cookie or bearer tokens. Please use this tag for asking question regarding Keycloak Gatekeeper here. For more details please see documentation https://www.keycloak.org/docs/latest/securing_apps/index.html#_keycloak_generic_adapter
barbajs,barba.js is a javascript library that helps you creating fluid and smooth transitions between your website&#39;s pages.
api-versioning,
flair,
go-echo,"Echo is a high performance, extensible, minimalist Go web framework. This tag should be used with general questions concerning the Echo framework or any related middleware,"
dimensionality-reduction,"In machine learning and statistics, dimensionality reduction or dimension reduction is the process of reducing the number of random variables under consideration, and can be divided into feature selection and feature extraction."
autofill,"Autofill relates to auto-populating data into user interface forms, etc."
adoptopenjdk,"AdoptOpenJDK is a community of Java User Group (JUG) members, Java developers and vendors with the purpose of producing high-quality runtimes and associated technology for use within the Java ecosystem. The Eclipse Adoptium project is the continuation of the original AdoptOpenJDK mission."
codemirror,"CodeMirror is an in-browser code editor, written in JavaScript. Among its notable features are syntax-highlighting, code-completion, auto-formatting and key-binding. The code-assist and highlighting capabilities are written as plugins called &#39;modes&#39;, and the editor supports many languages out of the box, but it can be extended to add support for any desired language.
"
hacker-news,
reactive-forms,Questions about Angular Reactive Forms(not template-driven forms). Use this tag for questions related to reactive-forms. Please mention the version of the angular used where you see the issue.
flags,Flags are atomic data structures used to identify state in a program.
bundling-and-minification,Bundling and minification are used to optimize web content by reducing the number of requests to the server and as well as the size of requested assets (such as CSS and JavaScript).
polymorphic-functions,
vscode-liveshare,
aws-amplify-sdk-js,Use this tag to group queries related to AWS Amplify that are related to the JavaScript SDK as opposed to the Amplify CLI or the iOS / Android libraries. 
cfbundleicons,Use this tag for question related to IOS property list CFBundleAlternateIcons dictionary for programmatically change the IOS app&#39;s icon.
runner,
request-pipeline,ASP.NET MVC Request Handling Pipeline. The flow that ASP.NET MVC runs from the time when the request is made until returning the contents to the user&#39;s browser.
momentjs,"A JavaScript date library for parsing, manipulating, and formatting dates.  Use this tag for issues with moment, moment-timezone, and any moment plugins.

NOTE: As of September 2020, the Moment team recommends you chose a different library for new projects.  See the Project Status section of the Moment docs.  On StackOverflow, please refrain from recommending Moment as a solution unless Moment is specifically asked for in the question."
git-reset,Sets the current Git repo head to a specified commit and optionally resets the index and working tree to match.
geojson,"GeoJSON is an open format, based on JSON, for encoding geographic data."
java-5,Java SE version 5 was released in September 2004 and is no longer supported by Sun as of November 2009. Use only if your question is specifically related to features of this version.
hashbytes,A hashing function within the Microsoft Transact-SQL Database Engine.
transparency,Transparency is the property of being see-through; a transparent object reveals objects behind it.  Transparency is also known as alpha blending.  The opposite of transparency is opacity.
top-n,
obs,"OBS (Open Broadcaster Software), is a software package designed for video recording and live streaming, supporting a limited version of HLSL for implementing custom pixel shaders."
google-photos,The new photos app allows you to choose photos and videos from your device (local and online)
lwp,The World-Wide Web library for Perl - LWP is a set of Perl modules which provides a simple and consistent application programming interface (API) to the World-Wide Web.
netcdf,NetCDF (Network Common Data Form) is a binary file format for storing array-oriented scientific data. Use this tag for questions about programmatically encoding and/or decoding data to/from NetCDF files.
rect,"To be used with RECT structure when using winapi. For questions relating to rectangles not using this api, use the [rectangles] tag. Use with other relevant tags, such as programming language."
primefaces-extensions,PrimeFaces Extensions is a lightweight open source component library for Java Server Faces 2.x. The project is built on top of the PrimeFaces - a rapidly evolving component suite. PrimeFaces Extensions consists of extended components missing in other JSF 2.x libraries or with improved components which already exist somewhere but don&#39;t work there smoothly.
react-native-swiper,
unit-testing,"Unit testing is a method by which individual units of source code are tested to determine if they are fit for use.
"
ngmodel,Use ngmodel for questions related to the ng-model AngularJS directive.
coin-or,COIN-OR (Computational Infrastructure for Operations Research) is a collection of Open Source software for modelling and optimization in the Operations Research community
transform,Coordinate and other transformations. You probably want a more specific tag like [css-transforms].
jcache,"JCACHE :JSR 107- Java Temporary Caching API. Specifies API and semantics for temporary, in-memory caching of Java objects, including object creation, shared access, spooling, invalidation, and consistency across JVM&#39;s. 

source: https://jcp.org/en/jsr/detail?id=107"
rvalue-reference,"An rvalue reference is a new language feature in C++11 representing a reference to an rvalue. Together with reference collapsing, they are used to implement and enable move semantics and perfect forwarding."
hikvision,
printers,"A Printer is a peripheral which produces a text or graphics of documents stored in electronic form, usually on physical print media such as paper or transparencies."
reflections,"For questions about the Java Reflections library (org.reflections.reflections) by ronmamo, which performs Java runtime metadata analysis, in the spirit of Scannotations."
johnsnowlabs-spark-nlp,John Snow Labs’ NLP is a natural language processing tool built on top of Apache Spark ML pipelines
api-doc,"Inline Documentation for RESTful web APIs.
apiDoc creates a documentation from API annotations in your source code."
android-orientation,"The orientation of the screen, i.e. landscape (wider than tall) or portrait (taller than wide)"
pydot,pydot is a python-module to serve as an easy interface to Graphviz&#39;s dot language. 
metalkit,MetalKit is a framework that made its first appearance in iOS 9 and OS X El Capitan. It provides functions and classes intended to reduce the effort required to create a `Metal` application.
parallelism-amdahl,"Amdahl&#39;s law, also known as Amdahl&#39;s argument, is used to find the maximum expected improvement to an overall system when only part of the system is improved. It is often used in parallel computing to predict the theoretical maximum speedup using multiple processors. The law is named after computer architect Gene Amdahl, and was presented at the AFIPS Spring Joint Computer Conference in 1967."
feather,Feather is a file format for storing data frames. It allows fast data exchange between Python and R.
ksuid,
buttonclick,An event that occurs when a user clicks a button element located within a user interface
c#-record-type,
sql-server-json,
evp-cipher,The EVP cipher routines are a high level interface to certain symmetric ciphers. 
undefined,A variable is undefined if it has not been assigned a value.
unicode,"Unicode is a standard for the encoding, representation and handling of text with the intention of supporting all the characters required for written text incorporating all writing systems, technical symbols and punctuation."
msys,"MSYS is a collection of GNU utilities such as bash, make, gawk and grep for Microsoft Windows, supporting UNIX shell scripting, and building of applications and programs which depend on the availability of traditional UNIX tools. Primarily, it is intended to complement MinGW, by compensating for many of the deficiencies of Windows&#39; own cmd.exe shell."
floating-accuracy,Concerning the accuracy of operations performed on floating point numbers.
coverlet,
changestream,"As a feature of MongoDB, Change streams allow applications to access real-time data changes in database."
laravel-upgrade,
swing,Swing is the primary user-interface toolkit in Java and is shipped with the standard Java SDK. It is contained within the package javax.swing.
google-data-catalog,
azure-ad-b2c,Azure AD B2C is a cloud identity management solution for web and mobile applications targeting your customers (consumers and businesses).
pulumi,a platform for building and deploying cloud infrastructure and applications with code
multistage-pipeline,
android-architecture-lifecycle,
3d-printing,Most questions about 3D printing should be posted to the dedicated site at 3dprinting.stackexchange.com.
reposurgeon,A tool by Eric S. Raymond for surgical operations on repositories during conversion
intersection,Intersection is a term that relates to descriptive geometry and functions. Intersections are points which are included in multiple objects. They are intersections of the object they belong to.
properties,"A property, in some object-oriented programming languages, is a special sort of class member, intermediate between a field (or data member) and a method. Properties are read and written like fields, but property reads and writes are (usually) translated to get and set method calls. "
python-keyring,Python library for accessing a system&#39;s native keyring service. It can be used for secure password storage.
avplayerlayer,AVPlayerLayer is a subclass of CALayer to which an AVPlayer object can direct its visual output.
android-update-app,
alembic,Alembic is a lightweight database migration tool for usage with the SQLAlchemy Database Toolkit for Python.
database-replication,Database replication is used to ensure consistency between redundant databases and to improve reliability and increase fault-tolerance.  The replication process commonly involves continuously duplicating a &quot;master&quot; database to one or more additional &quot;slave&quot; databases.
uitableview,"UITableView is a class used for displaying and editing lists of information on iOS. A table view displays items in a single column. UITableView is a subclass of UIScrollView, which allows users to scroll through the table, although UITableView allows vertical scrolling only."
architecture,"Architecture encompasses the process, artifacts and high-level structure of a solution."
reach-router,"Reach Router is a simple routing library for React designed to have a small footprint. Not to be confused with [react-router] for early versions, though the two libraries have merged as of Reach Router V2."
insertion-sort,"Insertion sort is a sorting algorithm with worst-case time complexity of O(n&#178;) and best-case time-complexity of Θ(n). It builds the final array by moving elements upward into the sorted position, one at a time."
lintr,
tax,a financial charge or other levy imposed upon a taxpayer (an individual or legal entity) by a state or the functional equivalent of a state to fund various public expenditures.
google-cloud-api-gateway,
ctad,"Class Template Argument Deduction, introduced in C++17, allows deducing missing template arguments for class template instantiation based on the initializer."
facebook-analytics,"Facebook Analytics is a product analytics tool that lets you quickly see data, analyze trends, and understand the behavior of people who use your app, website, and more."
review,"For questions about systems that implement reviews, such as an e-commerce platform that has a reviews component.  DO NOT use this tag for questions about code reviews."
opentext,"Open Text is a company based out of Waterloo, Ontario, Canada. It offers software for Enterprise Information Management."
webauthn,Browser API implementing the Web Authentication standard. Credentials are stored on (local) authenticators which use and are accessed using strong cryptography. 
newrelic,"New Relic is a web and mobile application performance monitoring service for Ruby, Java, .NET, PHP, Python, Node.js, Go, Android, and iOS apps."
bind,"This tag means different things in different contexts: consider using less ambiguous tags instead. Common meanings include: the bind function in socket programming; binding to naming contexts; the bind method in jQuery; BIND the DNS server (named), . For boost::bind in C++, use [boost-bind]. Do not use this tag just to say that you&#39;re binding something to something else."
arel,"Arel is a Relational Algebra for Ruby. It simplifies the generation complex of SQL queries and it adapts to various RDBMS systems.
"
ado,Microsoft ActiveX Data Objects (ADO) is a COM based package for accessing databases such as SQL Server or data sources such as Excel spreadsheets. ADO.NET provides improvements over ADO along with integration with the .NET Framework for .NET developers. ADO.NET tag should be used for ADO.NET specific questions.
azure-app-service-plans,
s4,The S4 object class system is one of the methods of object oriented programming in the R language.
react-three-fiber,"Questions about React-three-fiber, a React renderer for Three.js."
php-curl,PHP cURL extension for HTTP requests
remote-repository,
diagrammer,DiagrammeR is a R package for creating diagrams.
tinkerpop,Apache TinkerPop™ is a graph computing framework for both graph databases (OLTP) and graph analytic systems (OLAP).
bash-trap,Use this tag for questions about the `trap` Bash built-in.
foundry-data-connection,Questions related to development using Palantir Foundry&#39;s Data Connection application are appropriate to use here.
elementwise-operations,
footnotes,An additional piece of information printed at the bottom of a page.
staging-table,Staging tables are used in data ETL (extraction transformation and loading) processes and data warehousing.
xticks,
xpc,XPC is a low level library that simplifies inter process communication (IPC) on iOS and OS X.
rx-java2,anything related to RxJava2 – The new implementation of the RxJava Reactive Extensions for the JVM – a library for composing asynchronous and event-based programs using observable sequences for the Java VM.
javax.crypto,The javax.crypto package contains standard java classes for various cryptographic operations. It is part of Java SE since version 1.4.
genetic-algorithm,A genetic algorithm (GA) is a search heuristic that mimics the process of natural evolution.
forecasting,Forecasting involves estimating values (or distributions) that have not yet been observed.
pycocotools,
pandas-ml,"pandas-ml is a package which integrates pandas, scikit-learn, xgboost into one package for easy handling of data and creation of machine learning models."
systemctl,systemctl is used to control the systemd system and service manager.
django-3.1,"Django 3.1 is a version of the Django framework, released in August 2020. Please only use this tag if your question relates specifically to this version."
apn,Use this tag for Access Point Name only. For Apple Push Notifications use the [apple-push-notifications] tag.
reverse-engineering,"Reverse engineering is the process of discovering the technological principles of a human made device, object or system through analysis of its structure, function and operation."
watchos-6,Only use this tag for questions that specifically apply to the Apple watchOS version 6. Use the [watch-os] tag for questions related to watchOS generally. Hardware questions generally belonging to the Apple Watch should be in the Ask Different community.
tabbar,TabBar is a ActionScript UI component used for switching between different application states.
openrowset,"OPENROWSET is a T-SQL function that can be used in Microsoft SQL Server to read remote data from an OLE DB data source. It also supports bulk operations that can read data from a file and return it as a rowset.
"
openfx,OpenFX is an open standard for visual effects plug-ins.
orthanc-server,
mysql-workbench,MySQL Workbench is a visual database design tool that is developed by MySQL. It is the successor application of the DBDesigner4 project.
free-theorem,Tool for generating free theorems for sublanguages of Haskell.
recharts,"Recharts is a composable charting library built on React components and D3

"
fast-ai,"Fastai is a deep learning library for Python. It is built on top of PyTorch, and provides high level API to various common deep learning applications and data types."
mysql-connector-python,MySQL Connector/Python is a pure-Python database adapter which enables Python programs to access to MySQL databases.
char-pointer,Character Pointer is a data type which holds the address of a primitive charter type variable.
docblocks,"A DocBlock is a specially formatted PHP comment which allows external document generators to generate documentation of APIs and helps some IDEs to interpret variable types, provide improved code completion, type hinting and debugging."
angular-router-events,
derby,"Use this  tag for questions about Apache Derby, an Apache DB subproject. Derby is an open source relational database implemented entirely in Java and available under the Apache License, Version 2.0."
psutil,"psutil (python system and process utilities) is a cross-platform library for retrieving information on running processes and system utilization (CPU, memory, disks, network) in Python. "
measurement,
classpath,"In Java, the classpath tells the Java Virtual Machine where to look for user-defined classes and packages when running Java programs. The classpath is a parameter and can be set either on the command-line, or through an environment variable. "
domexception,"a DOM object for exceptions commonly thrown from the document object; example, calling createElement with an invalid tag name throws a DOMException"
machine.config,"Use this tag for questions about Machine.config, a configuration file used by various incarnations of the .NET Framework. Questions should also be tagged with the appropriate framework, for example [.net]."
onrestoreinstancestate,
git-subtree,An alternative to the git-submodule command. Merges and splits subtrees from your project into subprojects and back.  git-subtree has been merged into mainline git as of 1.7.11.
templates,"The templates tag is used in multiple contexts: generic programming (especially C++), and data/document generation using template engines. When using this tag on implementation heavy questions - tag the code language the implementation is written in."
javacameraview,
couchbase-lite,"Couchbase Lite is an ultra-lightweight, reliable, secure JSON database built for online/offline mobile application needs and is part of Couchbase&#39;s Mobile product."
android-deep-link,
preloader,Preloader is usually referred to the Gif image shown to user to indicate wait or processing state.
azure-queues,"Microsoft Azure (formerly Windows Azure before March 25, 2014) is a cloud computing platform and infrastructure, created by Microsoft, for building, deploying and managing applications and services through a global network of Microsoft-managed data centers. Azure Queue storage is used for transporting messages between applications as normally we can consider a MSMQ do that in cloud. "
readline,"A library for command line editing, or a function to read one line of text."
pyttsx,"pyttsx is a Python package supporting common text-to-speech engines on Mac OS X, Windows, and Linux."
leaf,For questions regarding the Leaf templating language that is used with the Vapor web framework
illegalstateexception,"About java.lang.IllegalStateException, a general-purpose exception defined in the Java API."
google-cloud-shell,Google Cloud Shell is a shell environment for managing resources hosted on Google Cloud Platform.
vuforia,An Augmented Reality Software Development Kit (SDK) for mobile devices that enables the creation of Augmented Reality applications.
disconnect,"A break or interruption in an existing connection, continuum, or process."
phpunit,PHPUnit is a programmer-oriented testing framework for PHP. It is an instance of the xUnit architecture for unit testing frameworks.
writer-monad,
contiguous,
silent-notification,
glib,"GLib is a general-purpose and cross-platform utility library, which provides many useful data types, macros, type conversions, string utilities, file utilities, a main loop abstraction, and so on."
matrix-inverse,"The matrix inverse, A^{-1}, is a mathematical relationship such that given a square n x n matrix A, A*A^{-1} = A^{-1}*A = I, where I is the identity matrix.  Use this tag with regards to any numerical methods or computations that require the use or calculation of the matrix inverse."
for-comprehension,for-comprehension is construction in Scala language allowing easy iteration over one or more collections.
google-apps,"DO NOT USE ALONE.Questions should be tagged with more specific, relevant tags whenever possible. 
 - For questions about programmatic interactions with services via [google-apps-script] or where no appropriate API tag exists, use: [google-docs] [google-sheets] [google-drive] [google-calendar] [gmail] [google-maps]
 - For questions regarding API usage, use [google-sheets-api] [google-docs-api] [google-maps-api] [google-calendar-api]"
clear-site-data,This tag is for questions about the Clear-Site-Data HTTP header.
logical-operators,"Logical operators are symbols that aid in evaluating boolean expressions. These are found in just about every programming language that supports boolean. Common examples are &amp;&amp; (AND), || (OR), ! (NOT), == ([value] equal to), === ([value and type] equal to), &gt;= (Greater than or equal to), &lt;= (Less than or equal to), &gt; (Greater than), and &lt; (less than) "
opencart2.3,"Opencart version 2.3.x and above, released July 30 2016"
webpack-plugin,"A bundler for javascript and friends. Packs many modules into a few bundled assets. Code Splitting allows to load parts for the application on demand. Through &quot;loaders&quot; modules can be CommonJs, AMD, ES6 modules, CSS, Images, JSON, Coffeescript, LESS, ... and your custom stuff."
googlebot,Googlebot is Google&#39;s web crawling bot which discovers new and updated pages/documents from the web to build a searchable index for the Google search engine.
go,"Go is an open-source programming language. It is statically-typed, with a syntax loosely derived from C, adding automatic memory management, type safety, some dynamic typing capabilities, additional built-in types such as variable-length arrays (called slices) and key-value maps, and a large standard library."
fetch,"For questions about the JavaScript Fetch API, use the [fetch-api] tag instead. For the git subcommand, use [git-fetch]. The [fetch] tag is a general-purpose tag for the keyword used in many programming languages, which is usually part of an instruction to retrieve data."
dashboard,"A dashboard is a user interface that organizes and presents information in a way that is easy to read to the user of a website. A dashboard typically indicates items which require urgent actions at the top of the page, moving into less important statistics at the bottom."
