Tags,Meaning
redisson,"Redisson - distributed Java objects and services (Set, Multimap, SortedSet, Map, List, Queue, BlockingQueue, Deque, BlockingDeque, Semaphore, Lock, AtomicLong, CountDownLatch, Publish / Subscribe, Bloom filter, Remote service, Spring cache, Executor service, Live Object service, Scheduler service) on top of Redis server"
intermediate-language,"An intermediate language, in compiler design, is a low-level language that typically resembles an idealized assembly language, often a textual representation of bytecode for a virtual machine. For .NET&#39;s CIL, use the [cil] tag."
war,"Web Application Archive - Is Jar file used to distribute JavaServer Pages, Java Servlets, Java classes, XML files, tag libraries and static Web pages (HTML and related files) that together constitute a Web application."
javaparser,A Java Parser with AST (abstract syntax tree) generation and visitor support.
neupy,NeuPy is a Python library for Artificial Neural Networks and Deep Learning that uses Theano as a backend.
ipatool,
io,"In computing, input/output, or I/O, refers to the communication between an information processing system (such as a computer), and the outside world, possibly a human, or another information processing system."
population,A population is a complete set of items that share at least one common characteristic.
javac,"javac is the primary Java compiler, included in the Java Development Kit (JDK) from Sun Microsystems (now Oracle), and also in versions from other vendors."
reportprogress,
push-notification,"Push notifications are alerts, badges, or sounds which are pushed to a mobile device from a remote server.

Apple delivers push notifications via the Apple Push Notification Service (APNS). Android devices receive push notifications via the Google Cloud Messaging (GCM) service. In the past, Android devices used the Cloud to Device Messaging (C2DM) framework. Windows Phone apps receive push notifications either via MPNS or the newer WNS."
react-final-form,Subscription-based form state management for React
docsify,
avaudioengine,"Use this tag when your question is about the AVAudioEngine class, which is part of the AVFoundation framework."
sfspeechrecognizer,Use this tag for iOS 10+ Speech framework&#39;s main class SFSpeechRecognizer.
hl7,The HL7 (Health Level Seven) messaging standard is a communication standard for exchanging electronic information in the domain of health care.
yeoman-generator,Yeoman generator is a scaffolding system built on top of Node.js
branching-and-merging,"In version control, branches represent parallel lines of development. Merging is the action that integrates changes made in different branches."
pcap,"pcap (packet capture) consists of an application programming interface (API) for capturing network traffic. The pcap file format is a binary format, and is the de facto standard format for network packet capture."
messaging,"Messaging refers to the design pattern whereby discrete messages are used for communication between objects or processes. Messages can be simple data, complex data structures, or even code. This pattern is often used for asynchronous or parallel computing."
fragmentmanager,"
FragmentManager is an interface for interacting with Fragment objects inside an Activity in Android. While the FragmentManager API was introduced in HONEYCOMB, a version of the API at is also available for use on older platforms through FragmentActivity.

For more information about using fragments, read the Fragments developer guide."
google-api-ruby-client,The Google API Ruby Client makes it trivial to discover and access Google APIs.
manifest,"A manifest is a file containing metadata about an application, data file or assembly. Generally an ambiguous tag, try and use a more specific one."
validationattribute,Used for classes Validation Attribute Classes in .NET within the System.ComponentModel.DataAnnotations namespace
text-processing,Mechanizing the creation or manipulation of electronic text.
chicken-scheme,CHICKEN is a compiler for the Scheme programming language.
jstack,Java Virtual Machine (JVM) Stack Trace dumper tool.
nvm-windows,NVM for Windows is the npm/Google/Microsoft recommended Node.js version manager for Windows. Questions relative to this utility should use the nvm-windows tag.
css-calc,"calc() is a native CSS way to do simple math right in CSS as a replacement for any length value (or pretty much any number value). It has four simple math operators: add (+), subtract (-), multiply (*), and divide (/). "
nvm,Node Version Manager - Simple bash script to manage multiple active node.js versions
ner,"Named Entity Recognition (NER) involves pulling out specific entities like persons, organization, or places from natural language text. "
cortex-m,"For all ARM Cortex-M series cores, including M0, M0+, M1, M3, M4, M7, M23 and M33."
apache-httpcomponents,A Java library for interacting with HTTP services. 
timeval,
errorbar,"Error bars are a graphical representation of the variability of data and are used on graphs to indicate the error, or uncertainty in a reported measurement."
react-refresh,
cosine-similarity,"Cosine similarity is a measure of similarity between two vectors of an inner product space that measures the cosine of the angle between them. It is a popular similarity measure between two vectors because it is calculated as a normalized dot product between the two vectors, which can be calculated with simple mathematical operations."
leveldb,"LevelDB is a fast key-value storage library written at Google that provides an ordered mapping from string keys to string values.

"
metro-bundler,"Metro is a JavaScript bundler. It takes in an entry file and various options, and gives you back a single JavaScript file that includes all your code and its dependencies."
azure-sdk-for-java,
express-rate-limit,
event-arc,
esp8266wifi,
grpc-java,Java version of general RPC (Remote Procedure Call) framework over HTTP/2.
keyboard-shortcuts,Keyboard shortcuts provide quick access to application or system actions via combinatorial key presses.
multer,Multer is a node.js component used to handle multipart/form-data uploads.
symfony-forms,"The Symfony form component is a standalone library that can be used outside of Symfony projects.

"
swiper,Mobile touch slider &amp; framework with hardware accelerated transitions
parallel.foreach,Parallel.ForEach() is a .Net method for processing a collection in parallel.
gitlens,
azure-application-gateway,
typegraphql,"TypeGraphQL is a library that provides you some decorators, and you can use these decorators to define your parts of schema."
mediarecorder,"Mediarecorder is the Android class used for recording Audio and Video available since API Level 1.  (For the Web-API, use the [web-mediarecorder] tag instead.)"
rayon,"A Rust data-parallelism library that makes it easy to convert sequential computations into parallel

Rayon is lightweight and convenient for introducing parallelism into existing code. It guarantees data-race free executions and takes advantage of parallelism when sensible, based on work-load at runtime."
tail-call-optimization,"A tail-call optimization is when a function returns directly the result of a called function, to avoid allocating a new stack frame. It is especially useful in recursive functions."
istream,"In C++ std::istream is the base class for input streams.
"
django-validation,django-validation refers to form and field validation tools provided by Django out of the box
localnotification,A Cordova/PhoneGap plugin to create local notifications on iOS devices using hybrid apps
packaging,Packaging is a configuration management process involved with capturing the knowledge needed to install or uninstall software on a target system.
wing-ide,"Wing IDE is an integrated development environment for Python, made by Wingware and available both in free and paid editions."
dummy-variable,"Dummy or indicator variables are used to include categorical or qualitative variables or factors into a regression model in R programming language for statistical computing, bioinformatics, and graphics."
ckeditor,CKEditor is an ecosystem of Open Source rich text editors with support for real-time collaboration. Use this tag together with the [ckeditor4] and [ckeditor5] tags to indicate the editor version.
safari-web-inspector,"The Web Inspector allows you to view the page source, live DOM hierarchy, script debugging, profiling and more! "
dump,"Recording the contents of memory after application or operating system failure, or by operator request, in a core dump for use in subsequent problem analysis. Also, recording a file or medium as a backup."
xcode,"Xcode is Apple&#39;s integrated development environment (IDE). USAGE NOTE: Use this tag only for questions about the Xcode IDE itself, and not for general Mac or iOS programming topics. Use [cocoa] for Mac programming questions, and [cocoa-touch] or [iOS] or [Swift] for iOS programming questions."
redis-cluster,"Redis Cluster provides a way to run a Redis installation where data is automatically sharded across multiple Redis nodes.
"
dropout,Dropout is a technique to reduce overfitting during the training phase of a neural network.
mobile-development,This tag should be used for questions about software development aimed specifically at the mobile environment but not directed at a specific mobile environment such as iOS or Android.
uint,is a type of variable and is used to store the equivalent of a mathematical non-negative integer 
tshark,tshark is the command line version of wireshark; a free and open-source packet analyzer.
struct-member-alignment,
decompiling,Decompilers analyze binary code outputting source code in a higher level language such as C.  The output is generally not any easier to analyze than the original assembler due to loss of information during compilation.
sim800,The SIM800 is a complete Quad-band GSM/GPRS solution in a SMT module which can be embedded in the customer applications. It is the successor of the SIMCom [tag:sim900].
modifier,
azure-devtest-labs,"For questions about Microsoft Azure DevTest Labs, for provisioning self-service dev/test environments on Azure. DevTest Labs has tools for setting policies on the kinds and sizes of VMs that can be created, for customising them with additional installation scripts, and for controlling costs and user access to the resulting dev/test environments."
accounting,"Systematic recording, reporting, and analysis of financial transactions of a business."
.net-standard,The .NET Standard is a formal specification of .NET APIs that are intended to be available on all .NET runtimes. The motivation behind the .NET Standard is establishing greater uniformity in the .NET ecosystem. Consider tagging a more specific version of .NET Standard in your question.
mediabrowserservicecompat,
microsoft-sync-framework,The Microsoft Sync Framework enables data synchronization in .NET applications in a hub-and-spoke or peer-to-peer relation. It uses metadata to synchronize datasets from different sources and formats to subscribers.
whitespace,"Whitespace, or white space, is often used to refer to any combination of spaces, tabs, and new lines which create blank space between text, either horizontally or vertically."
setstate,Use for questions relating to the [setstate] method and component/widget state management in [reactjs] and [flutter].
block-device,"A block device is a computer data storage device.  It organizes data into fixed sized blocks that are  typically 512 or 4096 bytes long.  Data is indexed by a logical block address.  Block storage devices are widely available, including spinning hard drives or solid-state devices.  They may be used directly by applications or may have a filesystem or other data structure layered on top of them."
go-templates,Go language supports built-in template functionality. Packages with this support include 1) text/template and; 2) html/template.
nginx-reverse-proxy,"When a reverse proxy proxies a request, it sends the request to a specified proxied server (http or other), fetches the response, and sends it back to the client, as if it came from the reverse proxy itself. "
flutter-text,
node-promisify,For questions specific to the node.js built-in utility function: util.promisify(). When using this tag also include the more generic [node.js] tag.
android-dialog,Base class for Dialogs. A dialog in Android is a small window that prompts the user to make a decision or enter additional information. A dialog does not fill the screen and is normally used for modal events that require users to take an action before they can proceed.
google-cloud-kms,"This tag is for questions about Google Cloud KMS, a Google Cloud Platform service which allows developers to store and make use of encryption keys to secure data."
linux-distro,"Linux distributions are Unix-like operating systems consisting of the Linux kernel and a large collection of system software and applications such as word processors, spreadsheets, media players, and databases."
apache-spark,Apache Spark is an open source distributed data processing engine written in Scala providing a unified API and distributed data sets to users for both batch and streaming processing. Use cases for Apache Spark often are related to machine/deep learning and graph processing. 
cucumber-jvm,"Cucumber-JVM is a Cucumber implementation for the most popular JVM languages. Cucumber-JVM currently supports Java. There are also implementations for the following JVM languages, but as of version 2.1.0, they are unsupported:

    Groovy
    Scala
    Clojure
    Jython
    JRuby
    Rhino JavaScript
    Gosu
"
capturing-group,Capturing groups are regular expression constructs that makes use of capturing in regex to capture parts of the matched string during a match sequence in the regexp pattern.
terraform-provider-aws,Terraform Provider for AWS.
loopback4,Questions about Loopback version 4. Use this tag for Loopback questions which are specific to only version 4. General Loopback questions should be tagged with loopbackjs.
jquery-terminal,JQuery Terminal Emulator is a plugin for creating command line interpreters in your applications.
implicit-conversion,"Converting an object, variable or value from one type to another to satisfy a type restriction, without specifically requesting that conversion through language syntax.  "
powershell-7.0,"Use this tag for version specific questions about Windows PowerShell version 7.0. When using this tag also include the more generic [powershell] tag where possible. For general PowerShell topics, use the [powershell] tag. "
ransac,"RANSAC is an abbreviation for &quot;RANdom SAmple Consensus&quot;. It is an iterative method to estimate parameters of a mathematical model from a set of observed data which contains outliers. 
 It is a non-deterministic algorithm in the sense that it produces a reasonable result only with a certain probability, with this probability increasing as more iterations are allowed."
shopware6,
sparse-checkout,A working copy of version controlled code which doesn&#39;t include the whole repository.
categories,Categories are groupings of information.
xadisk,XADisk enables transactional access to existing file systems by providing APIs to perform file/directory operations
listview,A ListView is a graphical screen control or widget provided by UI libraries in a majority of modern operating systems to show items in a list form.
overload-resolution,"Overload resolution is a language mechanism to select among several viable function overloads. Its rules are intricate and often surprising, even for experienced users."
cgi,1) The Common Gateway Interface is a standard defining how web server software can delegate web page generation to a stand-alone application or executable file. 2) Computer Generated Imagery
precision-recall,"Precision and Recall are statistical measures of performance for information retrieval algorithms based on binary classification. Precision is a measure of the percent of all classifications (items retrieved) that are relevant. Recall is a measure of the percent of relevant classifications (items retrieved) successfully  found by the algorithm, relative to all relevant items that exist and could have been found."
sshfs,"SSHFS (Secure Shell File System) is a file system client to mount and interact with directories and files located on a remote server or workstation. The client interacts with the remote file system via the SSH File Transfer Protocol (SFTP), a network protocol providing file access, file transfer, and file management functionality over any reliable data stream that was designed as an extension of the Secure Shell protocol (SSH) version 2.0."
virtual-table,
assembly-loading,"Questions regarding loading assemblies in.NET core, including questions on assemblies explicitly loaded via the API, as well as questions on runtime exceptions related to assembly load failure: &quot;Could not load file or assembly...&quot;"
aws-alb,
google-cardboard,Google Cardboard is a virtual reality (VR) platform developed by Google for use with a fold-out cardboard mount for a mobile phone.
updates,"[Instead of using this tag, please use the appropriate tag for the software and/or library in question]

Updates can refer to the modification of data or configuration by an application, process, or service, or can refer to the modification of software by a process. This tag seems fairly useless, as most software engages in updating something most of the time."
laravel-5.8,"Laravel 5.8 is the previous stable version of the open-source PHP web framework created by Taylor Otwell. It was released on February 26, 2019. Use it in addition to the [laravel-5] tag if your question is specific to Laravel 5.8. Use the [laravel] tag for general Laravel related questions."
feature-engineering,Feature engineering is the process of using domain knowledge of the data to create features that make machine learning algorithms work
karma-coverage,A plugin for Karma (code test runner) that generate code coverage.
friend-class,"In object-oriented programming to allow access to &quot;private&quot; or &quot;protected&quot; data of a class in another class, the latter class is declared as a friend class."
kleisli,"Kleisli is an operator to compose monadic functions. if you have one monadic function that takes in As and outputs Bs and another monadic function that takes in Bs and outputs Cs, and you want to chain them together, you use Kleisli composition."
xslt-grouping,"Grouping mechanisms that are specific to XSLT. Should always be complemented with either the xslt-1.0, xslt-2.0 or xslt-3.0 tag to indicate the version used."
textinput,"For questions related to a single-line, text input. EG: `&lt;input type=&quot;text&quot; ...&gt;`, or a UITextField, or TextInput (Flash), or `&lt;textinput&gt;` (RSS). ...  Use textarea for multiline or WYSIWYG text controls.
"
content-script,"fContent scripts are JavaScript files, used by browser extensions or add-ons. They are the part of an extension that can interact with the document context of the current web page.  This mainly applies to Firefox or Chrome extensions."
git-push,Pushes the changes from a local Git repo to remote
autofac,Autofac is an inversion of control (IoC) container for Microsoft .NET. It manages the dependencies between classes so that applications stay easy to change as they grow in size and complexity. This is achieved by treating regular .NET classes as components.
hook-woocommerce,"Use this tag for questions related to WooCommerce hooks.
Hooks essentially allow you to change or add code without editing core files. They are used extensively throughout WordPress and WooCommerce and are very useful for developers."
jaxws-maven-plugin,Maven plugin adapter for JAX-WS&#39;s toolset
microdata,"Microdata is a syntax for expressing structured data in (X)HTML5 documents. (If the question is about the vocabulary Schema.org, use the [schema.org] tag.)"
tsx,Extension for TypeScript files using JSX syntax
apollo-client,Apollo Client is a JavaScript library for building client UIs that fetch data using GraphQL.
pystan,The Python Interface to Stan
abi,"The (Application Binary Interface) specifies the low level interface between the programs, libraries and the operating system. E.g. which registers are used to pass function parameters."
css-transitions,CSS Transitions allows property changes in CSS values to occur smoothly over a specified duration.
jetson-xavier,The NVIDIA Jetson AGX Xavier is an AI computer for autonomous machines.
ion,Asynchronous networking and image loading library for Android.
rijndael,Rijndael is a block cipher that won the Advanced Encryption Standard competition. A subset of it was standardized as AES (FIPS 197) in October 2000.
date-arithmetic,"The term &#39;date-arithmetic&#39; refers to determining via code such information as how many days, hours, etc. between two calendar dates, and determining the last day of the month, or whether a date is a weekday or a weekend. Be sure to also include the appropriate programming or database tag."
cdn,A content delivery network or content distribution network (CDN) is a system of computers containing copies of data placed at various nodes of a network.
versions-maven-plugin,The Versions Plugin is used when you want to manage the versions of artifacts in a project&#39;s POM.
jjwt,Use when referencing the JJWT library for the JVM and Android
xampp-vm,
android-highcharts,
flysystem,"flysystem is a PHP library that provides an abstraction layer for filesystems. It provides a common API for handling standard tasks across multiple file storage engines, and enables easily swapping local and remote filesystems and emulating directories in systems that don&#39;t support them."
tsc,tsc is a compiler for converting TypeScript into plain JavaScript.
string-formatting,Commonly refers to a number of methods to display an arbitrary number of varied data types into a string.
class-template,"Anything related to C++ class templates, i.e. classes whose definition depends on some parameter according to templates definition rules."
multiplatform,Software and methods said to be platform independent. 
adminlte,Use this tag if your question involves the use of the AdminLTE Control Panel Bootstrap Template.
defragmentation,The process of decreasing the amount of fragmented files on a computer&#39;s system hard drive.
electron-react-boilerplate,
swr,"SWR is a React Hooks library for remote data fetching.
"
data-structures,A data structure is a way of organizing data in a fashion that allows particular properties of that data to be queried and/or updated efficiently.
spring-retry,"Spring Retry provides an abstraction around retrying failed operations, with an emphasis on declarative control of the process and policy-based behaviour that is easy to extend and customize."
google-iam,Cloud Identity and Access Management (Cloud IAM) enables you to create and manage permissions for Google Cloud Platform resources. Cloud IAM unifies access control for Cloud Platform services into a single system and presents a consistent set of operations.
woocommerce,WooCommerce is an open source eCommerce plugin available for WordPress. Questions should relate to programming which changes or extends WooCommerce behaviour.
expo,Expo is an open-source and free platform that lets web developers build truly native apps that work across both iOS and Android by writing them once in just JavaScript. Use the Expo tag on questions about developing Expo projects and using the Expo dev tools like XDE and exp.
lookbehind,A lookbehind is a part of the regular expression standard.
react-static,react static site generator developed by nozzle 
redis-py,A Python interface to the Redis key-value store.
action-filter,"In ASP.NET MVC, controllers define action methods that usually have a one-to-one relationship with possible user interactions, such as clicking a link or submitting a form. For example, when the user clicks a link, a request is routed to the designated controller, and the corresponding action method is called."
maven-shade-plugin,"This plugin provides the capability to package the artifact in an uber-jar, including its dependencies and to shade - i.e. rename or remove - the packages of some of the dependencies."
row-number,An index or rank which indicates a row&#39;s position in a data-set.
jvm-arguments,Command-line options and environment variables that can affect the performance characteristics of the Java Virtual Machine
asp.net-core-mvc,"ASP.NET Core MVC is a lightweight presentation framework for creating dynamic websites with ASP.NET Core. It allows for creating controller based MVC sites, or view model based Razor pages. MVC includes features like routing, model binding and validation, filters, web APIs and the Razor view engine."
2-way-object-databinding,Two-way data binding (bidirectional data binding) refers to two components acting as the source object for the destination properties of each other.
importrange,This tag should be used to differentiate questions about the importing of a range of data from other questions on this site. Use when the topic is the IMPORTRANGE function. Should generally be used in conjunction with tag [google-sheets].
filesaver.js,FileSaver.js implements the HTML5 W3C saveAs() FileSaver interface in browsers that do not natively support it
ios14,"Use for questions specific to Apple&#39;s iOS 14 mobile operating system, released in 2020. General iOS questions should use the [ios] tag."
color-mapping,A color map is used when displaying intensity images (2D arrays). The color maps intensity values to RGB colors of the display.
