Tags,Meaning
qwerty,QWERTY is a keyboard layout where the first six keys appearing in the top left letter row of the keyboard read Q-W-E-R-T-Y from left to right.
httpsys,
bootstrap-table,"Bootstrap Table is an extended Bootstrap table with radio, checkbox, sort, pagination, and other added features."
decimalformat,"The Java class DecimalFormat is a concrete subclass of NumberFormat that is used to format decimal numbers. Use this tag only for questions about this Java class, not for general decimal formatting."
shapeless,shapeless is (an exploration of) a type class and dependent type based generic (aka polytypic/polymorphic) programming library for Scala.
hci,For questions about Host Controller Interface.
jackson,"Jackson is a Java library for handling tasks like reading and writing (parsing / generating) and data binding to/from Java objects. Although primarily used for JSON, Jackson also supports many other data formats such as Avro, CBOR, CSV, Java Properties, Protobuf, Smile, XML and YAML."
pmd,"PMD scans source code and looks for potential problems like possible bugs, dead code, suboptimal code, overcomplicated expressions, and duplicate code.
PMD supports Java, JavaScript, XML, and many more."
input-mask,"A string expression, defined by a developer, that governs what a user is allowed to enter in as input in a text box."
farsi,"The Farsi tag is for issues relating to Persian (Farsi, فارسی, پارسی) language."
configuration-as-code,"Configuration as code (CaC) is the process of managing configuration and settings through machine-readable definition files, rather than using interactive configuration tools."
time-series,"A Time series is a sequence of data points with values measured at successive times (either in continuous time or at discrete time periods). Time series analysis exploits this natural temporal ordering to extract meaning and trends from the underlying data.

"
scientific-computing,Use this tag for questions about using computers in science. Many of these questions also fit on scicomp.stackexchange.com.
nexus3,"Nexus is a Repository Manager for Maven, NuGet, Docker registries and other binary artifact repositories. Repository managers serve two purposes: they act as highly configurable proxies between your organization and the public repositories and they also provide an organization with a deployment destination for your internally generated artifacts."
grafana-variable,
parseint,parseInt is a function that returns the integer representation of a given string.
atexit,atexit(3) is a method for arranging a function to be called at a program&#39;s exit time.
pdfview,A Macintosh or iOS object that encapsulates the functionality of PDFKit and which can be dropped into an interface using Xcode&#39;s Interface Builder.
tortoisehg,TortoiseHg is a Windows shell extension and a series of cross-platform applications for the Mercurial distributed revision control system.
moving-average,"A calculation of the average value of the most recent (within some window) values in a time series, rather than the average of the entire series."
frappe,"Frappe is an open source full stack, low-code Python + JS web framework"
keras-2,
granularity,"Granularity is the extent to which a material or system is composed of distinguishable pieces or grains. It can either refer to the extent to which a larger entity is subdivided, or the extent to which groups of smaller indistinguishable entities have joined together to become larger distinguishable entities."
percona,"Percona builds free and open source database software that includes: Percona Server for MySQL&#174;, Percona Server for MongoDB, Percona XtraDB Cluster, Percona XtraBackup, Percona Monitoring and Management, and Percona Toolkit. 
The widely installed Percona Server for MySQL is a drop in replacement for MySQL, and includes XtraDB, an enhanced version of the InnoDB storage engine. 
"
inner-join,"A database operation that combines the values of 2 tables based on a condition, or relationship, that exists between those tables."
ngx-daterangepicker-material,
frame-rate,"Frame rate (also known as frame frequency) is the frequency (rate) at which an imaging device produces unique consecutive images called frames. The term applies equally well to computer graphics, video cameras, film cameras, and motion capture systems. Frame rate is most often expressed in frames per second (FPS)"
tomcat8.5,Version 8.5.x (June 2018 onwards) of the Apache Tomcat servlet container. Use only if your question is specifically related to features of this version.
client-certificates,X.509 certificates for client authentication during TLS handshake.
storage-access-framework,"The Storage Access Framework makes it simple for users to browse and open documents, images, and other files across all of their their preferred document storage providers on the Android platform."
swiftui-state,
flutter-futurebuilder,"For questions relating to Flutter&#39;s FutureBuilder class. Use this tag in combination with the general [flutter] tag. If your question applies to Flutter more generally, use the [flutter] tag only."
rgb,"RGB stands for Red-Green-Blue and specifies a color using three values, which represent the respective amount of red, green, and blue in the color.  RGB is the basis for the color model used by most color display devices nowadays."
aurora,"Apache Aurora is a Mesos framework for long-running services and cron jobs, responsible for scheduling and executing tasks across a shared pool of machines."
fxml,a scriptable XML-based language that provides the structure for building a JavaFX user interface separate from the application logic of your code.
chatkit,
jpype,JPype is an effort to allow python programs full access to java class libraries
fftpack,"FFTPACK is a package of Fortran subprograms for the fast Fourier transform of periodic and other symmetric sequences. It includes complex, real, sine, cosine, and quarter-wave transforms. Much of the package is also available in a C, Fortran, and Java translation."
rawstring,"A string literal which would be processed without any language-specific interpretation, avoiding the need of escaping characters and thus providing more legible strings."
gitops,"GitOps is a way to do Kubernetes cluster management and application delivery.  It works by using Git as a single source of truth for declarative infrastructure and applications. With Git at the center of your delivery pipelines, developers can make pull requests to accelerate and simplify application deployments and operations tasks to Kubernetes."
pcm,Use this tag for questions about the Pulse-Code Modulation representation of sampled signals.
red-black-tree,"A red-black tree is a type of self-balancing binary search tree, a data structure used in computing science, typically used to implement associative arrays."
pack-expansion,
mongodb-csharp-2.0,Version 2.0 of the C# driver for MongoDB.
micronaut-data,
steam,"Steam is an entertainment platform, payment system, and community for video games. Steam also provides simple API&#39;s and OpenID endpoints for user authentication. Use this tag for question relating to Steam or its OpenID endpoint."
listagg,"The LISTAGG analytic function was introduced in Oracle 11g Release 2, making it very easy to aggregate strings. The nice thing about this function is it also allows us to order the elements in the concatenated list. If you are using 11g Release 2 you should use this function for string aggregation."
baidu,"Baidu is a Chinese web services provider that offers APIs for cloud-based storage and application testing, in-app ads, location-based services, analytics, search and others."
phpword,"PHPWord is a library written in pure PHP that provides methods to create/write word processor document formats (Word 2007, Open/Libre Office and Rich-Text Format)."
time-format,Time formats are specifications used for unambiguous representation of dates and times. The International Standard for the representation of dates and times is ISO 8601. Each software platform usually provides APIs in order to parse dates or time in a language-independent manner.
xlsx,xlsx is the file extension for files created using the default format of Microsoft Excel 2007 or higher.
java-16,"Use this tag for questions specific to Java 16, which is version 16 of the Java platform, released on March 16, 2021. In most cases you should also specify the java tag."
rollup,The ROLLUP operator is useful in generating reports that contain subtotals and totals. The ROLLUP operator generates a result set that is similar to the result sets generated by the CUBE operator
avasset,"AVAsset is an abstract class to represent timed audiovisual media such as videos and sounds. Each asset contains a collection of tracks that are intended to be presented or processed together, each of a uniform media type, including but not limited to audio, video, text, closed captions, and subtitles."
points,A scoring system for games or algorithms. Geometric items should be tagged with coordinates or point.
fadein,"The fadeIn() method gradually changes the opacity, for selected elements, from hidden to visible (fading effect)."
phpdoc,"phpDocumentor (phpdoc) is an automatic code-documentation tool for PHP, based on Javadoc."
v-model,Use this tag for questions related to the v-model directive of Vue.js.
slot,slot is a method callback used to handle a signal in some gui frameworks like QT
ecmascript-2018,"ECMAScript 2018 (ES2018) is the 9th version of the ECMAScript language. Main features include asynchronous iteration, rest/spread properties and various extensions to regular expressions. Only use this tag where the question specifically relates to new features or technical changes provided in ECMAScript 2018."
build-numbers,Numbers generated by build processes to identify instances of a project that may not correspond to releases.
libcurl,"Use this tag only for questions related to the multiprotocol internet transfer library, for question related to command line tool please use the specific curl tag"
apple-cryptokit,
unity-container,"The Unity Application Block (i.e. Unity) is a lightweight, extensible dependency injection container for .NET with support for interception. Do _not_ use this tag to refer to the Unity game engine."
automaton,An automaton is a mathematical object describing an abstract machine with a finite set of states and transitions between these that runs on sequences of inputs consisting of letters (or symbols) picked from an alphabet.
background-service,A background service is a computer service that runs &quot;behind the scenes&quot; (i.e. in the background) and without user intervention.
private,Private is a way of encapsulation in object-oriented programming.
norm,NoRM is a MongoDB driver for .Net designed to provide access to strongly/statically-typed documents and collections.
pyviz,"PyViz is an initiative for making Python-based visualization tools work well together - includes holoviews, geoviews,  datashader, hvplot, panel, colorcet, param and imagen."
session-variables,Session variable is a unit of information within a session state. It is maintained across a user&#39;s visit within the constraints of the stateless HTTP protocol. 
google-sites,Google Sites is an online open source platform for building static websites.
slim-4,Slim 4 is an open source PHP micro framework that helps writing web applications and APIs.
uitest,
construction,"Use for questions related to building a data structure, such as a heap."
win-universal-app,"Windows Universal apps target multiple types of devices via a single codebase. 
Please specify with other tags if you refer to Windows 8.1 or Windows 10."
rotation,"A rotation is a circular movement of an object around a center (or point) of rotation.  
On a mobile device, it indicates the change of orientation."
laravel-airlock,Laravel Airlock provides a featherweight authentication system for SPAs and simple APIs.
ext4,Ext 4 is a linux filesystem.
compiler-flags,"Parameters that may be passed to a compiler affecting how compilation is carried out. These can have a variety of effects on the paths searched for external dependencies, optimization level, how source code is interpreted, code checks that are performed and preprocessor directives."
spring-mono,
amazon-route53,Amazon Route 53 is a highly available and scalable Domain Name System (DNS) web service. It is designed to give developers and businesses an extremely reliable and cost effective way to route end users to Internet applications by translating human readable names like www.example.com into the numeric IP addresses like 192.0.2.1 that computers use to connect to each other.
in-app-purchase,In-app purchase (IAP) usually refers to the acquisition of a feature for an application from within the application itself or the buying of digital goods from within an application. Use this tag for questions about writing code for the buying process. Questions about app-store policies or about specific transactions are off-topic on Stack Overflow and should not be posted.
protocolexception,
rrule,A rrule is used in the iCal format to specify rules for recurring events.
xcode12beta6,
azure-ad-b2b,
wsl-2,"This tag should be used for question about Windows Subsystem for Linux version 2.
It should not be used for WSL version 1."
styled-components,"styled-components is a JavaScript library for styling React applications. It removes the mapping between styles and components, and lets you write actual CSS augmented with JavaScript."
cloud,"Cloud computing is about hardware-based services involving computing, network and storage capacities. These services are provided on-demand, hosted by the cloud provider and can easily scale up and down."
protoc,"protoc is the compiler for .proto files. It generates language bindings for the messages and/or RPC services from .proto files.
protoc is a native executable, the scripts under this directory build and publish a protoc executable (a.k.a. artifact) to Maven repositories. The artifact can be used by build automation tools so that users would not need to compile and install protoc for their systems."
hive-metastore,"Hive Metastore refers to the central repository of Apache Hive (the open source of data ware house system built on top of hadoop) metadata, which stores metadata for Hive tables and partitions in a relational database.  Use this tag for questions related to the Apache Hive central repository."
dialogflow-es-fulfillment,"Dialogflow ES is a natural language platform owned by Google. (Formerly known as just Dialogflow or as api.ai.) A fulfillment in Dialogflow ES allows an intent to perform operations on input parameters and return an output. Use this tag when issues arise with building fulfillments. For questions about the Dialogflow ES API or UI, use the dialogflow-es tag. For the similarly named, but incompatible, Dialogflow CX, use the dialogflow-cx tag."
cstdint,"Header that declares types and macro constants to deal with fixed-width cross-platform integer types, available since C++11. This header replaces stdint.h wich is tagged as deprecated."
redux,"Redux is a pattern and library for managing JavaScript application state, using events called &quot;actions&quot;. It serves as a centralized store for state that is needed across your entire application, with rules ensuring that the state can only be updated in a predictable fashion. Redux make it easier to understand when, where, why, and how the state in your application is being updated, and how your application logic will behave when those changes occur."
sendmail,"DO NOT use as a general tag for sending email. This is about &quot;sendmail&quot;, the general purpose email routing facility that supports mail transport via TCP/IP using SMTP"
jenkins-pipeline,Questions about the Jenkins “Pipeline” plugin suite (formerly “Workflow”). Not about pipelines in Jenkins in general (e.g. using downstream jobs).
node-cron,
one-to-many,one-to-many is relationship between two different object properties. 
google-cloud-functions,"Google Cloud Functions is a lightweight, event-based, asynchronous compute solution that allows you to create small, single-purpose functions written in Node.js, Python or Go that respond to cloud events without the need to manage a server or a runtime environment.
"
java-security-manager,
sha,"SHA (Secure Hash Algorithm) is a family of digest algorithms (i.e. cryptographic hashes), i.e. checksum functions that are hard to forge. The recommended digest algorithms these days are SHA-1 and SHA-2 (which covers both SHA-256 and SHA-512). MD5 is a deprecated alternative."
sass-loader,
cvxopt,"A Python package for convex optimization, including solvers for linear programming, quadratic programming, semidefinite programming and more."
cabal-install,cabal-install is a package manager and dependency resolver for building and installing Haskell libraries.
automated-tests,"Test automation is the use of software to control the execution of tests, the comparison of actual outcomes to predicted outcomes, the setting up of test preconditions, and other test control and test reporting functions. Commonly, test automation involves automating a manual process already in place that uses a formalized testing process (wikipedia.org)."
apfs,"Apple file system. Designed for solid state storage devices. Used on MacOS, iOS, tvOS and watchOS."
apache-kafka-mirrormaker,"MirrorMaker is a Kafka tool to mirror a source Kafka cluster into a target (mirror) Kafka cluster. MirrorMaker2 is a newer implementation of the tool, and is based on the Kafka Connect Framework. "
sankey-diagram,"Sankey diagrams are a kind of flow diagram, in which the width of the arrows is shown proportionally to the flow quantity. They are typically used to visualize energy or material or cost transfers between processes."
monospace,Monospace or &quot;fixed pitch&quot; fonts have the same width for each character. They are most often used for code and for situations where a fixed line length is required.
odoo-13,Use this tag for version specific questions about Odoo 13 - the suite of open-source business applications written in Python. When using this tag also include the more generic [odoo] tag where possible.
subject-observer,Use this tag for questions related to an Observer for a Subject. Observers can subscribe to the subject to receive the last (or initial) value and all subsequent notifications.
getcomputedstyle,
azure-data-studio,Use this tag for issues related to Azure Data Studio and try tagging the platform as well. Ask the question on superuser.com if you are facing issues with installation
hiccup,"Hiccup is a library for representing HTML in Clojure. It uses vectors to represent tags, and maps to represent a tag&#39;s attributes."
generic-list,language-agnostic tag for a collection of items where each item has a certain position
oracle-spatial,Oracle Spatial is an extension to Oracle DB which provides support for location data.
intrinsic-content-size,
autocomplete,"Autocomplete is a UI feature provided by applications, where the program predicts a word or phrase that the user wants to type without the user actually typing it completely."
devops,"This tag is for programming questions about DevOps (&quot;development&quot; and &quot;operations&quot;), which is a software development method that stresses communication, collaboration, integration, automation, and measurement of cooperation between software developers and other IT professionals. Non-programming related questions should be asked on the DevOps Stack Exchange site."
watch,"Watch refers to observing the status of variables, files or directories for some or all possible actions such as additions, deletions or modifications.   "
beta-testing,A test for a computer product prior to commercial release.
private-members,"In object oriented programming, private members are those data fields, properties, or methods of a class that are only accessible from within the class itself. "
react-native-config,
ggmap,A package for plotting maps in R with ggplot2
apm,"APM generally refers to Application Performance Management. The best in class tools provide real-time access to detailed information about the performance of a system and its components (including transaction tracing, database and external system response times, etc.)"
codable,Use this tag only for questions directly pertaining to the Swift Codable protocol introduced in Swift 4. 
partition,"Use this tag for questions about code that partitions data, memory, virtual machines, databases or disks."
gnu,This tag is for programming questions related to software and tools provided by the GNU (&quot;GNU&#39;s Not Unix&quot;) project.
vbe,Visual Basic Editor is the built in IDE for writing VBA. It is hosted by various MS Office programs. Use this tag for general questions about the IDE or the Microsoft VBA Extensibility Library (VBIDE) which allows automation of the Visual Basic for Applications Editor.
stimulusjs,
in-app-subscription,"Google Play In-app billing subscriptions let you sell content, services, or features in your app with automated, recurring billing."
anomaly-detection,"In data mining, anomaly detection (also outlier detection) is the identification of items, events or observations which do not conform to an expected pattern or other items in a dataset."
blockly,"Blockly is an open-source web-based, graphical programming environment that enables users to write JavaScript, Python, PHP, and Dart programs by moving around blocks.  Developers can extend it to integrate with their own apps.  It has been translated into over 40 (human) languages."
survey,
mips,MIPS is a RISC instruction set architecture (ISA).  It is commonly used in embedded devices such as set top boxes and networking gear. Many university-level computer architecture classes use the MIPS ISA due to its relative simplicity.
zero-width-space,a control character used to indicate boundaries between words
prisma-binding,
standards,"Standards are officially published or well agreed upon formats, procedures, or protocols. They allow individuals or organizations to collaborate by setting ground rules or boundaries. Standards often come with a set of preconditions or assumptions, which allow collaborators to take those conditions or assumptions as ground truth."
dart-analyzer,Dart Analyzer is a package that provides a library that performs static analysis of Dart code. It is useful for tool integration and embedding.
flow,"This is a meta tag and should not be used.  See the wiki for more information.

For static type checker called &#39;Flow&#39; look into [flowtype] tag."
attribution,
aws-codecommit,AWS CodeCommit is a fully-managed source control service that makes it easy for companies to host secure and highly scalable private Git repositories. 
uncertainty,The uncertainties package is a python package that transparently handles calculations with numbers with uncertainties (like 3.14&#177;0.01). It can also yield the derivatives of any expression.
stdarray,std::array is a container that encapsulates constant size arrays in C++.
datalist,An ASP.NET control for rendering data in a list.
worker,"In software, the term worker usually describes a long-running process being executed in a separate thread from an application&#39;s main thread of execution. Consider [tag:web-worker] for javascript."
git-revert,Revert changes of a commit in a Git repository
json-patch,"JSON Patch defines the media type &quot;application/json-patch&quot;, a JSON document structure for expressing a sequence of operations to apply to a JSON document"
micronaut-aws,Projects using the specific Micronaut integration with Amazon Web Services (AWS) 
symlink,Symlink is short for symbolic link (also soft link). It is a term for any file that contains a reference to another file or directory in the form of an absolute or relative path and that affects pathname resolution.
standardization,
curses,"Curses is a library for unix-ish computers that you can use to have better and more interactive consoles, including colors. It is used in some console games, like the original Rogue."
holoviews,"HoloViews is a Python library that makes analyzing and visualizing scientific or engineering data much simpler, more intuitive, and more easily reproducible."
postfix-operator,"A postfix operator immediately succeeds its operand, as in x! for instance."
coreclr,"CoreCLR is the runtime for both .NET Core and .NET 5 on desktop and server operating systems. It is an execution engine for .NET apps, performing functions such as IL byte code loading, compilation to machine code, and garbage collection."
maxent,Software library based on the maximum-entropy approach for species habitat modeling
junit-rule,"Rules are feature of JUnit, which allow to execute code befor, after or instead of a test."
blogdown,blogdown is an R package for creating websites based on R Markdown and Hugo
unixodbc,unixODBC is an open source project that implements the ODBC API on non windows platforms.
cpu-cache,A CPU-cache is a hardware structure used by the CPU to reduce the average access memory time.
django-unittest,"django-unittest tag refers to writing unit tests in Django, tests that are expressed as methods on a Python class that subclasses unittest.TestCase or Django&#39;s customized TestCase."
react-router-redux,A library of bindings to keep react-router and redux in sync (formerly known as redux-simple-router).
